item_type,title,creators,first_name,last_name,ean_isbn13,upc_isbn10,description,publisher,publish_date,group,tags,notes,price,length,number_of_discs,number_of_players,age_group,ensemble,aspect_ratio,esrb,rating,review,review_date,status,began,completed,added,copies
book,"The Canary Islands: A Cultural History (Landscapes of the Imagination)","Peter Stone",Peter,Stone,9781908493996,1908493992,"The seven volcanic Canary Islands that bask in the Atlantic off shore from the north-west African coast have long had legendary connotations. To the Greeks they were the Gardens of the Hesperides, blessed with a perennial spring-like climate, while the Carthaginians christened them the 'Purple Isles' on account of the rich dye material they obtained there. Inhabitants have ranged from the early Berber-descended Guanches, of whom cultural traces still remain, to the rich blend of European and Latin peoples that evolved after the Spanish conquest in the fifteenth-century. Famous visitors have included Columbus, Humboldt and General Franco, who famously flew from Gran Canaria in a (British-piloted) Dragon Rapide in 1936 to launch Spain's Civil War. In today's cosmopolitan capitals of Las Palmas and Santa Cruz de Tenerife Spanish colonial-era buildings merge with modern centres equipped with sophisticated amenities. For holidaymakers tiny ecologically-oriented havens like Gomera vie with big brash tourist resorts like Playa del Ingles and Playa de las Americas, today's major money-makers after the brief trade boom of yesteryear. Peter Stone explores the fascinating history and culture of this archipelago, where nature and geology provide a spectacular setting for today's tourism industry. FANTASY LANDSCAPE Bone dry 'badlands', orange-grey dunes, giant craters, frozen lava flows, black-sanded coves, rich green bananas plantations and sylvan woodlands shrouded in perennial mists all form part of this multi-faceted paradise. NATIONAL PARKS AND WILD LIFE Four of Spain's fifteen great national parks are located on the islands; Tenerife's 3,700-metre Teide, the country's highest mountain, is the most visited. Island fauna vary from the desert-like lizards of Lanzarote to the rich bird life of La Palma. UNIQUE LOCAL CULTURE Local fiestas abound and traditional dance and music exhibitions are held in cultural centres like Gran Canaria's Pueblo Canario. Mould-breaking Lanzarote architect Cesar Manrique has left a supreme legacy of innovative buildings and monuments.","Signal Books",2014-09-25,,,,,256,,,,,,,,,,,,,2025-06-16,1
book,"Get Out of My Life, but First Could You Drive Me & Cheryl to the Mall: A Parent's Guide to the New Teenager, Revised and Updated","Anthony E. Wolf",Anthony,Wolf,9780374528539,0374528535,"A brand new edition of the bestselling guide to raising teenagersWhen Anthony E. Wolf's witty and compassionate guide to raising adolescents was first published, its amusing title and fresh approach won it widespread admiration. Beleaguered parents breathed sighs of relief and gratitude. Now Dr. Wolf has revised and updated his bestseller to tackle the changes of the past decade. He points out that while the basic issues of adolescence and the relationships between parents and their children remain much the same, today's teenagers navigate a faster, less clearly anchored world. Wolf's revisions include a new chapter on the Internet, a significantly modified section on drugs and drinking, and an added piece on gay teenagers. Although the rocky and ever-changing terrain of contemporary adolescence may bewilder parents, Get Out of My Life gives them a great road map.","Farrar, Straus and Giroux",2002-08-01,,,,,240,,,,,,,,,,,,,2025-06-16,1
book,"The Last Word: An Autobiography","Quentin Crisp",Quentin,Crisp,9780692968482,0692968482,"The Last Word is the third and final installment of Quentin Crisp's autobiography. The Last Word was written by Crisp with the help of his best friend, Phillip Ward, who tape-recorded and later transcribed Quentin’s words between 1997-1999. The Last Word was published on November 21, 2017, the eighteen-year anniversary of Crisp's passing.","MB Books LLC",2017-11-07,,,,,232,,,,,,,,,,,,,2025-06-16,1
book,"Cuban Heels","Emily Barr",Emily,Barr,9780755301928,0755301927,"Maggie moves to Brighton after splitting up with her long-term boyfriend, and, unable to find a job, starts work as a lapdancer. Failing to make any new friends, she writes letters compulsively, and the highlight of her day is the sound of the morning post being delivered. Maggie gradually becomes obsessed with the married couple, Libby and David, living next door. Libby has given up work after having a baby, and is finding life as a full-time mother very difficult. Just as she persuades David that she should return to work, he is asked to take a sabbatical from his management-consultant job. He's always longed to travel, and convinces Libby that they should spend six months in Cuba, learning Spanish. Maggie, deciding she too wants to travel, follows them to Havana, where the horrors of her past - in particular her young sister's violent death - begin to haunt her. And as Maggie starts to break down, she tries to take over Libby's life...","Headline Review",2004-03-15,,,,,320,,,,,,,,,,,,,2025-06-16,1
book,"Disclosure: A Novel","Michael Crichton",Michael,Crichton,9780345539007,0345539001,"From the author of Jurassic Park, Timeline, and Sphere comes an electrifying thriller in which a shocking accusation of sexual harassment triggers a gripping psychological game of cat and mouse and threatens to derail a brilliant career. &nbsp; #1 NEW YORK TIMES BESTSELLER &nbsp; &ldquo;A fresh and provocative story.&rdquo;&mdash;People &nbsp; An up-and-coming executive at the computer firm DigiCom, Tom Sanders is a man whose corporate future is certain. But after a closed-door meeting with his new boss&mdash;a woman who is his former lover and has been promoted to the position he expected to have&mdash;Sanders finds himself caught in a nightmarish web of deceit in which he is branded the villain. &nbsp; As Sanders scrambles to defend himself, he uncovers an electronic trail into the company&rsquo;s secrets&mdash;and begins to grasp that a cynical and manipulative scheme has been devised to bring him down. &nbsp; &ldquo;Crichton writes superbly. . . . The excitement rises with each page.&rdquo;&mdash;Chicago Tribune &nbsp; &ldquo;A heart-stop story running on several tracks at once. Disclosure is up to [Crichton&rsquo;s] usual locomotive speed.&rdquo;&mdash;The Boston Globe &nbsp; &ldquo;Expertly crafted, ingenious and absorbing.&rdquo;&mdash;The Philadelphia Inquirer","Ballantine Books",2012-11-27,,,,,464,,,,,,,,,,,,,2025-06-16,1
