item_type,title,creators,first_name,last_name,ean_isbn13,upc_isbn10,description,publisher,publish_date,group,tags,notes,price,length,added,copies,collection,physical_format,revision,categories,language,public_domain,subjects,weight
book,A Thousand Sisters: My Journey into the Worst Place on Earth to Be a Woman,Lisa J Shannon,Lisa,Shannon,9781580053594,1580053599,"Lisa Shannon had what some would call a good lifeher own business, a successful fiancé, a secure home. Then one day in 2005, shortly after her father’s death, an episode of Oprah changed everything. The show about women in the Congo depicted atrocities too horrible to comprehend: millions dead, women gang-raped and tortured, children starving and dying in shocking numbers. That day Lisa woke up to her dissatisfaction with the good” life and to her role as an activist and a sister.She created a foundation called Run for Congo Women, with the goal to raise money to sponsor 30 Congolese women. What started as a solo 30-mile run has now grown into a national organization in connection with Women for Women International. Run for Congo Women holds fundraising runs in four countries and ten states, and continues to raise money and awareness. In A Thousand Sisters, Lisa shares firsthand accounts of her experiences visiting the Congo, the women she’s helped, and the relationships she’s formed. With compelling stories of why she remains committed to this cause, Lisa inspires her audience to reach out and help as well, forming a sisterhood that transcends geographic boundaries.",Seal Press,2011-02-01,,,,,344.0,2025-06-19,1,Willoughby,,2.0,Biography & Autobiography,en,False,"Women and war, Refugees africa, War victims, Humanitarian assistance, Congo (democratic republic) history",0.350
book,The Last Continent,Terry Pratchett,Terry,Pratchett,9780061059070,0061059072,"Something is amiss at Unseen Unversity, Ankh-Morpork&#039;s most prestigious (i.e., only) institution of higher learning. A professor is missing&mdash;but a search party is on the way! A bevy of senior wizards will follow the trail wherever it leads&mdash;even to the other side of Discworld, where the Last Continent, Fourecks, is under construction. Imagine a magical land where rain is but a myth and the ordinary is strange and the past and present run side by side. experience the terror as you encounter a Mad Dwarf, the Peach Butt, and the dreaded Meat Pie Floater.Feel the passion as the denizens of the Last Continent learn what happens when rain falls and the rivers fill with water (it spoils regattas, for one thing). Thrill to the promise of next year&#039;s regatta, in remote, rustic Didjabringabeeralong. It&#039;ll be asolutely gujeroo (no worries).",HarperTorch,2000-02-02,,,,,416.0,2025-06-19,1,Willoughby,,18.0,Fiction,en,False,,
book,Red Scarf Girl,Ji-Li Jiang,Ji-Li,Jiang,9780064462082,0064462080,a,Trophy Pr,,,,,,,2025-06-19,1,Willoughby,Paperback,6.0,Juvenile Nonfiction,en,False,"History, Human geography / peoples of the world, Politics & government, Juvenile literature, Cultural Revolution 1966-1969, Children's Books/Young Adult Biography, Personal narratives, Juvenile Nonfiction, Children: Young Adult (Gr. 7-9), China, Biography & Autobiography - Historical, Biography & Autobiography - Political, History - Asia, Juvenile Nonfiction / Biography & Autobiography / Political, Children's 12-Up - Biography / Autobiography, People & Places - Asia, Jiang Ji-li",5.6 ounces
book,Bike Paths of Massachusetts: A Guide to Rail-Trails &amp; Other Car-Free Places,Stuart A. Johnstone,Stuart,Johnstone,9780962799075,0962799076,Bike Paths Of Massachusetts,Active Pubns,2006-08-01,,,,,,2025-06-19,1,Willoughby,Paperback,6.0,Bicycle touring,en,False,"United States - Northeast - New England (General), Travel",12.2 ounces
book,Stick Dog,Tom Watson,Tom,Watson,9780062268174,0062268171,"Meet Stick Dog - a new breed of hero! In his first adventure, Stick Dog and his friends embark on an epic quest to steal a hamburger. With hilarious illustrations and pitch-perfect humour, Stick Dog is a must-have for fans of WIMPY KID and BIG NATE. Stick Dog and his friends, Mutt, Stripes, Karen and Poo-Poo have caught the scent of hamburgers and what hungry stray could resist that lovely meaty waft? All they have to do is follow the smell, find the barbecue and eat the hamburgers. But it&#039;s not as easy as it sounds. The dogs need a &#039;Master Plan&#039; and they&#039;re not short of ideas. They&#039;re just short of ideas that aren&#039;t ridiculous, or dangerous, or just very very silly. With hilarious artwork, and an adorable four-legged hero, the story of Stick Dog&#039;s quest for a delicious dinner is destined to be Top Dog. More STICK DOG adventures coming soon.",Harpercollins,,,,,,188.0,2025-06-19,1,Willoughby,paperback,2.0,Juvenile Fiction,en,False,,
book,Bamboo Ridge No. 113,"Gail N. Harada (Editor), Lisa Linn Kanae (Editor)",Gail,Harada,9780910043991,091004399X,"Magazine. Poetry. Fiction. Asian & Asian American Studies. Hawai'i Interest. BAMBOO RIDGE NO. 113 is the 40th Anniversary Issue from the oldest and longest running independent literary small press in Hawai'i. Edited by Gail N. Harada, author of BEYOND GREEN TEA AND GRAPEFRUIT (Bamboo Ridge Press, 2013) and Lisa Linn Kanae, author of SISTAH TONGUE (Tinfish Press, 2003) and ISLANDS LINKED BY OCEAN (Bamboo Ridge Press, 2009), the milestone anthology features work by 50 diverse authors, and cover and interior art by Noe Tanigawa. Included in the issue are emerging writers new to the pages of BAMBOO RIDGE as well as local literary luminaries, including the following, all winners of the Elliot Cades Award for Literature: Donald Carreira Ching, Marie Hara, Juliet S. Kono, Brenda Kwon, Darrell H. Y. Lum, Wing Tek Lum, Christy Passion, Craig Santos Perez, Eric Paul Shaffer, Cathy Song, and Joseph Stanton.",Bamboo Ridge Press,2018-09-13,,,,,352.0,2025-06-19,1,Willoughby,,1.0,American literature,en,False,,0.568
book,Professor Romeo,Anne Bernays,Anne,Bernays,9781555842185,1555842186,,"Grove/Atlantic, Incorporated",1989-07-01,,,,,288.0,2025-06-19,1,Willoughby,Hardcover,13.0,Fiction,en,False,"College teachers -- Fiction., Teacher-student relationships -- Fiction., Seduction -- Fiction., Cambridge (Mass.) -- Fiction.",
book,Ed Emberley's Big Purple Drawing Book,Edward R Emberley,Edward,Emberley,9780316234238,0316234230,"A cluster of circles becomes a bunch of grapes, which turns into a panda, which becomes . . . ""Jaunty and clever.""--Kirkus Reviews. Full color.",LB Kids,1981-09-30,,,,,92.0,2025-06-19,1,Willoughby,,11.0,Juvenile Nonfiction,en,False,"Drawing -- Technique -- Juvenile literature., Purple in art -- Juvenile literature., Drawing -- Technique.",
book,Kids' Kookiest Riddles,"Steve Charney, Rob Collinet (Illustrator)",Steve,Charney,9781402740589,1402740581,"What do you get if you cross a pig and a centipede? Bacon and legs. Who did Dracula marry? The girl necks door. With hundreds of hysterical riddles to choose from, there’s non-stop amusement. Kids will keep dipping into this kooky, crazy collection, just for laughs. The subjects range from ""Bugs, Beasts, and Birds” to ""You Could Have Food Me.” There are even ""Goofball Poems” like this: It’s a dog’s delight to bark all night, And a nightingale’s to sing. And if you sit on a red-hot stove, It’s the sign of an early spring. Every one is fun!","Sterling Publishing Co., Inc.",2007-02-01,,,,,96.0,2025-06-19,1,Willoughby,,2.0,Juvenile Nonfiction,en,False,"Riddles, Riddles juvenile literature",0.118
book,Speak by Design,Stephanie Bickel,Stephanie,Bickel,9798351345413,,"With over 20 years as a communication coach, Stephanie Bickel shares her system for coaching senior leaders into the C-Suite. This is a practical guide to developing your unique communication style while growing your network and rising to the top. This is a modern guide for communication in a hybrid business world. Understand how to use your visual, vocal and verbal style to make presentations come alive - both in-person and virtual Become more aware of your strengths Be better prepared to handle difficult questions Learn practical tips and tricks for presenting more effectively Develop a more confident mindset around public speaking",Independently Published,2022-09-06,,,,,43.0,2025-06-19,1,Willoughby,,,,en,False,,
book,The Bedford Handbook,Diana Hacker,Diana,Hacker,9780312256319,0312256310,"The Bedford Handbook carries on the Hacker tradition by responding to student writers&rsquo; needs and to the way students need their handbook to work. Still a full-size handbook that doubles as a reference, the Handbook features clear, straightforward advice, hand-edited sentences, a user-friendly index, and a handy format. The eighth edition combines classic Hacker usability with a next-generation focus on academic writing and research and new navigation that helps students pull together advice and models for each assignment. Developed with the help of students and teachers at more than 35 colleges and universities, the new edition reflects the ways students write and revise in their composition course and beyond. What&rsquo;s more, The Bedford Handbook remains a portable size; it&rsquo;s still a comprehensive reference that&rsquo;s as easy to consult as it is to carry.",Bedford/St. Martin's,2001-11-26,,,,,849.0,2025-06-19,1,Willoughby,,11.0,Language Arts & Disciplines,en,False,"English language -- Rhetoric -- Handbooks manuals etc, English language -- Grammar -- Handbooks manuals etc, Report writing -- Handbooks manuals etc",
book,Two Degrees,Alan Gratz,Alan,Gratz,9781338865127,1338865129,"When three children endure separate climate change disasters--a wildfire in the California woods, a close encounter with a hungry polar bear in Canada, and a massive hurricane in Florida--they emerge from their experiences committed to changing the world.",,2022-01-01,,,,,,2025-06-19,1,Willoughby,,,Juvenile Fiction,en,False,,
book,"The Pregnancy Instruction Manual: Essential Information, Troubleshooting Tips, and Advice for Parents-to-Be (Owner's and Instruction Manual)",Sarah Jordan,Sarah,Jordan,9781594742453,1594742456,"At last! A comprehensive guide to worry-free pregnancy!   Bringing a baby into the world is one of life’s defining moments. But there’s no getting around it: Being pregnant can feel overwhelming.   Fortunately, The Pregnancy Instruction Manual is here to answer all of your most pressing questions. Will the morning sickness ever go away? How big is my baby at 26 weeks? Are beef jerky cravings normal? How do I ward off the unwanted tummy-touch era? And most of all, will I ever get a good night’s rest again? Expectant parents will find the answers here courtesy of veteran mom Sarah Jordan and certified OB-GYN (and three time dad) David Ufberg. ",Quirk Books,2008-06-01,,,,,224.0,2025-06-19,1,Willoughby,Paperback,15.0,Health & Fitness,en,False,"Personal & Practical Guides, Reference / Personal & Practical Guides, Pregnancy & Childbirth, Health & Fitness, Reference, Health/Fitness",
book,Accused: A Rosato &amp; DiNunzio Novel,Lisa Scottoline,Lisa,Scottoline,9781250027672,1250027675,"The all-female law firm of Rosato &amp; Associates has always been on the side of what is right. But true justice isn’t always black and white. . .  Mary DiNunzio, who just made partner, takes on her most unusual case yet, brought to the firm by Allegra Gardner, a thirteen-year-old genius from an extraordinarily wealthy family. Allegra’s sister, Fiona, was murdered six years ago, and it seemed like an open-and-shut case: the accused, Lonnie Stall, was seen fleeing the scene; his blood was on Fiona and her blood was on him; and, most damning, Stall pleaded guilty. But young Allegra believes Stall is innocent―and wrongly imprisoned. The powerful Gardner family and Allegra’s own parents oppose reopening the case, so taking it on is risky. But Rosato &amp; Associates can never resist an underdog. Was justice really served all those years ago? It will take Mary and her team of unstoppable lawyers, plus one teenager, to learn the truth.",St. Martin's Paperbacks,2016-08-02,,,,,432.0,2025-06-19,1,Willoughby,,3.0,Fiction,en,False,"Fiction thrillers general, Fiction mystery & detective women sleuths, Women lawyers fiction, Crime fiction",
book,Do More Great Work: Stop the Busywork. Start the Work That Matters.,Michael Bungay Stanier,Michael,Stanier,9780761156444,0761156445,"You work hard. You put in the hours. Yet you feel like you are constantly treading water with &quot;Good Work&quot; that keeps you going but never quite moves you ahead. Or worse, you are mired in &quot;Bad Work&quot;&mdash;endless meetings and energy-draining bureaucratic traps.Do More Great Work gets to the heart of the problem: Even the best performers are spending less than a fraction of their time doing &quot;Great Work&quot;&mdash;the kind of innovative work that pushes us forward, stretches our creativity, and truly satisfies us. Michael Bungay Stanier, Canadian Coach of the Year in 2006, is a business consultant who&rsquo;s found a way to move us away from bad work (and even good work), and toward more time spent doing great work.When you&rsquo;re up to your eyeballs answering e-mail, returning phone calls, attending meetings and scrambling to get that project done, you can turn to this inspirational, motivating, and at times playful book for invaluable guidance. In fifteen exercises, Do More Great Work shows how you can finally do more of the work that engages and challenges you, that has a real impact, that plays to your strengths&mdash;and that matters.The exercises are &quot;maps&quot;&mdash;brilliantly simple visual tools that help you find, start and sustain Great Work, revealing how to:Find clues to your own Great Work&mdash;they&rsquo;re all around youLocate the sweet spot between what you want to do and what your organization wants you to doGenerate new ideas and possibilities quicklyBest manage your overwhelming workloadDouble the likelihood that you&rsquo;ll do what you want to doAll it takes is ten minutes a day, a pencil and a willingness to change. Do More Great Work will not only help you identify what the Great Work of your life is, it will tell you how to do it.",Workman Publishing Company,2010-02-22,,,,,200.0,2025-06-19,1,Willoughby,,2.0,Body Mind & Spirit,en,False,,
book,Seedfolks,"Paul Fleischman, Judy Pedersen (Illustrator)",Paul,Fleischman,9780064472074,0064472078,"A vacant lot, rat-infested and filled with garbage, looked like no place for a garden. Especially to a neighborhood of strangers where no one seems to care. Until one day, a young girl clears a small space and digs into the hard-packed soil to plant her precious bean seeds. Suddenly, the soil holds promise: To Curtis, who believes he can win back Lateesha's heart with a harvest of tomatoes; to Virgil's dad, who sees a fortune to be made from growing lettuce; and even to Maricela, sixteen and pregnant, wishing she were dead. Thirteen very different voices and perspectives—old, young, Haitian, Hispanic, tough, haunted, and hopeful—tell one amazing story about a garden that transforms a neighborhood. Chosen as a state and citywide read in communities across the country, including in Vermont; Racine, WI; Tampa, FL; Newburgh, NY; and Boca Raton, FL. Supports the Common Core State Standards",HarperCollins Publishers,2004-12-14,,,,,112.0,2025-06-19,1,Willoughby,Paperback,6.0,Juvenile Fiction,en,False,"Lifestyles - City Life, Social Issues - General, Gardens, Children: Grades 4-6, Juvenile Fiction, Children's Books/Ages 9-12 Fiction, Neighborhood, Nature & the Natural World - Gardening, Lifestyles - City & Town Life, Juvenile Fiction / Social Situations / General, Social Situations - General, City and town life, Fiction",0.8 ounces
book,Will Solvit and the Aztec Empire of Doom,"Zed Storm, E. Hawken (Text by), Rachel Elliot",Zed,Storm,9781445404615,1445404613,,Parragon Book Service Limited,2010-01-01,,,,,123.0,2025-06-19,1,Willoughby,paperback,4.0,Juvenile Fiction,en,False,,
book,Greatest Jokes on Earth,"Matt Rissinger, Philip Yates",Matt,Rissinger,9780806920627,0806920629,"Step right up and enjoy this three-ring circus of howlers and groaners that will make you the class clown! * Did you hear about the circus strongman who could lift an elephant with one finger? Problem was, it took him ten years to find an elephant with one finger. Every imaginable kind of funny stuff parades across the pages--Riddles. Knock-knocks. Wordplay. Tongue-twisters, and more. And the subjects cover the universe--from Star Wars, ET, and Godzilla, to assorted monsters, ghosts, vampires. More samplings: * Why was the slime monster so proud of himself? He found out he got listed in ""Ooze Who."" * What do computerized bears do in the winter? They cybernate.  96 pages, 5 3/8 x 8 1/4.",Sterling,1999-06-30,,,,,96.0,2025-06-19,1,Willoughby,,11.0,Humor,en,False,"Riddles Juvenile., Wit and humor Juvenile., Riddles., Jokes.",
book,Ghostbusters Movie Novelization (Ghostbusters 2016 Movie),Stacia Deutsch,Stacia,Deutsch,9781481475129,1481475126,"If there’s something strange in your neighborhood, who you gonna call? Ghostbusters! Ghostbusters—starring Melissa McCarthy, Kristen Wiig, Kate McKinnon, Leslie Jones, and Chris Hemsworth—glides into theaters on July 15, 2016 with a hilarious paranormal adventure!Strange things have been happening in New York City. Mysterious ectoplasm has been oozing down walls, haunted figures are bursting out of locked rooms, and—rumor has it—a supernatural superfan wreaked havoc at a recent rock concert! Luckily there’s a group that’s ready to take the lead and rid the city of its ghostly infestation—the Ghostbusters! Grab your proton packs and join the Ghostbusters in this hilarious, action-packed retelling of the all-new movie that features an eight-page, full-color, glossy insert with images from the film! Ghostbusters TM &amp; © 2016 Columbia Pictures Industries, Inc. All rights reserved.",Simon Spotlight,2016-06-14,,,,,144.0,2025-06-19,1,Willoughby,paperback,7.0,Juvenile Fiction,en,False,,
book,National Geographic Traveler: Beijing,Paul Mooney,Paul,Mooney,9781426202315,1426202318,"National Geographic Traveler: Beijing presents a comprehensive portrait of the city, including the dramatic changes it is undergoing for the Olympics. Detailed maps as well as specifics about the new transportation system help visitors navigate this intriguing capital city, plus interesting excursions beyond. The guide features cut-away illustrations of renowned structures plus descriptions of such well-known sites as Tiananmen Square, the Forbidden City, and the Summer Palace. The guide explores lesser known sites as well, including the Muslim Quarter, Baoguo Temple, Military Museum, Fragrant Hills Park, and the Great Wall—including a trek from Lotus Mountain to Huanghua Cheng.",National Geographic,2008-04-15,,,,,272.0,2025-06-19,1,Willoughby,Paperback,8.0,Travel,en,False,"Travel & holiday guides, Travel, Travel - Foreign, China, Asia - China, Travel / Asia / China, Asia - General",
book,Pastoral Care And Counseling With Latino/as (Creative Pastoral Care &amp; Counseling),R. Esteban Montilla,R.,Montilla,9780800638207,0800638204,"The Latino population is a pastorally challenging polyculture. This diversity requires spiritual caregivers to approach every Hispanic individual with humbleness. &quot;Cada persona es un mundo,&quot; &quot;every person is a world,&quot; says Montilla. To equip professionals in ministry for their ministry with and for Latino/as, Montilla centers his presentation on families and rituals at the heart and soul of the Hispanic community as the key to caregiving. In that context he unfolds a variegated picture of the particular cultural guideposts for Latinas and Latinos in the U.S. today, especially their symbols and rituals, attitudes toward health and healing, abiding faith, and contemporary quest for creative agency and dignity. He closes by exploring pastoral strategies with issues of discrimination and racism, and contemporary issues in providing pastoral counseling with Latinas and Latinos.",FORTRESS PRESS,2006-05-01,,,,,164.0,2025-06-19,1,Willoughby,Paperback,15.0,Religion,en,False,"Christian Ministry - Counseling & Recovery, Religion, Religion - Pastoral Care / Counseling, Church work with Hispanic Americans, Pastoral care, Pastoral counseling",8 ounces
book,Cold Mountain: A Novel,Charles Frazier,Charles,Frazier,9780375700750,0375700757,"NOW A MAJOR MOTION PICTUREOne of the most acclaimed novels in recent memory, Charles Frazier&#039;s Cold Mountain is a masterpiece that is at once an enthralling adventure, a stirring love story, and a luminous evocation of a vanished American in all its savagery, solitude, and splendor.  Sorely wounded and fatally disillusioned in the fighting at Petersburg, Inman, a Confederate soldier, decides to walk back to his home in the Blue Ridge Mountains and to Ada, the woman he loved there years before.  His trek across the disintegrating South brings him into intimate and sometimes lethal converse with slaves and marauders, bounty hunters and witches, both helpful and malign.  At the same time, Ada is trying to revive her father&#039;s derelict farm and learn to survive in a world where the old certainties have been swept away.  As it interweaves their stories, Cold Mountain asserts itself as an authentic American Odyssey--hugely powerful, majestically lovely, and keenly moving.",Vintage,1998-08-12,,,,,464.0,2025-06-13,1,Inman,,19.0,Fiction,en,False,United States -- History -- Civil War 1861-1865 -- Fiction,
book,Themen Aktuell: 1: Kursbuch (German Edition),Hartmut Aufderstrasse,Hartmut,Aufderstrasse,9783190016907,3190016909,"Neu: Bei allen Ausgaben enthält das Kursbuch »Themen aktuell 1« jetzt gratis die CD-ROM zum multimedialen Üben.

Themen aktuell ist die aktualisierte und optisch völlig überarbeitete Ausgabe von Themen neu. Themen aktuell bietet durchgehend neue Zeichnungen und Fotos in einem modernen Layout. Einige Texte und Übungen wurden inhaltlich der heutigen Zeit angepasst.

Zielgruppe: Erwachsene Anfänger in Grundstufenkursen an Volkshochschulen, Goethe-Instituten, Universitäten, privaten Sprachschulen und anderen Institutionen weltweit, die Kurse in Deutsch als Fremdsprache erteilen.

Lernziel: Kommunikation in Alltagssituationen; aktive Teilnahme an Gesprächen über allgemein interessierende Themen; sinnvoller Umgang mit einfachen literarischen und feuilletonistischen Texten sowie Sachtexten.
Themen aktuell 1 führt bis zur Niveaustufe A1 nach dem Referenzrahmen des Europarats, Themen aktuell 2 zum Niveau A2 und Themen aktuell Zertifikatsband zum Niveau B1 (Zertifikat Deutsch).

Konzeption: Themen aktuell ist ein Lehrwerk mit kommunikativer Zielsetzung, d. h. mit Anstößen zu authentischen Gesprächen und zur Erarbeitung von Redemitteln, die für eine reibungslose Kommunikation im Alltag wichtig sind. Fertigkeitsspezifische Übungen sind eingebettet in eine systematische Progression der Lexik und der grammatikalischen Strukturen.
Textverstehen: Besonderes Gewicht liegt auf der Übung des Hörverstehens und des Leseverstehens durch ein breites Angebot speziell ausgewählter bzw. bearbeiteter Hör- und Lesetexte. 
Grammatik: Das Verständnis für die grammatikalischen Strukturen wird induktiv aus den Texten heraus erarbeitet. Grammatikübersichten ermöglichen eine schnelle Orientierung über den schon gelernten Stoff.
Wortschatz: Durch zahlreiche Übungen und durch Kontrolllisten wird eine sichere Beherrschung des Wortschatzes erreicht.",Max Hueber Verlag,2002-11-01,,,,,160.0,2025-06-13,1,Inman,Paperback,11.0,Foreign Language Study,de,False,ELT: Learning Material & Coursework,13.1 ounces
book,The New Young Oxford Book of Ghost Stories (Vol 2),,,,9780192781543,0192781545,"Following the success of &quot;The Young Oxford Book of Ghost Stories&quot;, here is a second volume. The stories are drawn from the early twentieth century tradition of ghost stories, together with contemporary stories that develop and extend this tradition. An additional feature to this collection is that it contains original stories that have been specially commissioned for these books.",Oxford University Press,1999-12-16,,,,,224.0,2025-06-13,1,Inman,,12.0,Juvenile Fiction,en,False,"Ghost stories English., Children's stories English., Ghosts -- Fiction., Short stories.",
