item_type,title,creators,first_name,last_name,ean_isbn13,upc_isbn10,description,publisher,publish_date,group,tags,notes,price,length,added,copies,collection,physical_format,revision,categories,language,public_domain,subjects,weight
book,Joey Pigza Swallowed the Key (Joey Pigza Books),Jack Gantos,Jack,Gantos,9780064408332,64408337,"Joey Pigza can&#039;t sit still. He can&#039;t pay attention, he can&#039;t follow the rules, and he can&#039;t help it -- especially when his meds aren&#039;t working. Joey&#039;s had problems ever since he was born, problems just like his dad and grandma have. And whether he&#039;s wreaking havoc on a class trip or swallowing his house key, Joey&#039;s problems are getting worse. In fact, his behavior is so off the wall that his teachers are threatening to send him to the special-ed center downtown. Joey knows he&#039;s really a good kid, but no matter how hard he tries to do the right thing, something always seems to go wrong. Will he ever get anything right?",HarperCollins,2000-04-30,,,,,160.0,2025-06-13,1,Maple,,23.0,Juvenile Fiction,en,False,"Attention-deficit hyperactivity disorder -- Fiction, Schools -- Fiction, Single-parent families -- Fiction",
book,"Are You There God?  It's Me, Margaret",Judy Blume,Judy,Blume,9780440404194,440404193,"Are You There God? It&#039;s Me, Margaret No one ever told Margaret Simon that eleven-going-on- twelve would be such a hard age.&nbsp;&nbsp;When her family moves to New Jersey, she has to adjust to life in the suburbs, a different school, and a whole new group of friends.&nbsp;&nbsp;Margaret knows she needs someone to talk to about growing up-and it&#039;s not long before she&#039;s found a solution.Are you there God?&nbsp;&nbsp;It&#039;s me, Margaret. I can&#039;t wait until two o&#039;clock God.&nbsp;&nbsp;That&#039;s when our dance starts.&nbsp;&nbsp;Do you think I&#039;ll get Philip Leroy for a partner?&nbsp;&nbsp;It&#039;s not so much that I like him as a person God, but as a boy he&#039;s very handsome.&nbsp;&nbsp;And I&#039;d love to dance with him... just once or twice.&nbsp;&nbsp;Thank you God.",Yearling,1972-01-01,,,,,160.0,2025-06-13,1,Maple,paperback,3.0,Juvenile Fiction,en,False,,
book,"Hannah Arendt: For Love of the World, Second Edition",Elisabeth Young-Bruehl,Elisabeth,Young-Bruehl,9780300105889,300105886,"This highly acclaimed, prize-winning biography of one of the foremost political philosophers of the twentieth century is here reissued in a trade paperback edition for a new generation of readers. In a new preface the author offers an account of writings by and about Arendt that have appeared since the book&rsquo;s 1982 publication, providing a reassessment of her subject&rsquo;s life and achievement.Praise for the earlier edition:&ldquo;Both a personal and an intellectual biography . . . It represents biography at its best.&rdquo;&mdash;Peter Berger, front page, The New York Times Book Review &ldquo;A story of surprising drama . . . . At last, we can see Arendt whole.&rdquo;&mdash;Jim Miller, Newsweek&ldquo;Indispensable to anyone interested in the life, the thought, or . . . the example of Hannah Arendt.&rdquo;&mdash;Mark Feeney, Boston Globe&ldquo;An adventure story that moves from pre-Nazi Germany to fame in the United States, and . . . a study of the influences that shaped a sharp political awareness.&rdquo;&mdash;Richmond (Va.) Times-DispatchCover drawing by David Schorr",Yale University Press,2004-10-11,,,,,620.0,2025-06-13,1,Maple,Paperback,6.0,Biography & Autobiography,en,False,"Philosophers, Biography & Autobiography, Biography / Autobiography, Biography/Autobiography, Political, Biography & Autobiography / General",1.9 pounds
book,"Heroes and Saints and Other Plays: Giving Up the Ghost, Shadow of a Man, Heroes and Saints",Cherrie Moraga,Cherrie,Moraga,9780931122743,931122740,"Heroes and Saints &amp; Other Plays is Chicana playwright Cherr&iacute;&not;e Moraga&#039;s premiere collection of theatre. Included are: Shadow of a Man, winner of the 1990 Fund for New American Plays Award; Heroes and Saints, winner of the Dramalogue, the PEN West, and the Critics Circle awards, as well as the Will Glickman Prize for Best Play of 1992; and Giving Up the Ghost, first published by West End Press in 1986, and now presented here in its revised stage version.",West End Press,1994-12-31,,,,,149.0,2025-06-13,1,Maple,Paperback,15.0,Drama,en,False,"Drama texts: from c 1900 -, Ethnic studies, Modern fiction, Plays & playwrights, American, American Contemporary Drama, Hispanic American Drama, Drama, Plays / Drama, American English, Fiction, USA, Literary Criticism & Collections / Women Authors",7.8 ounces
book,Ceremony (Contemporary American Fiction Series),Leslie Marmon Silko,Leslie,Silko,9780140086836,140086838,"Tayo, a young Native American, has been a prisoner of the Japanese during World War II, and the horrors of captivity have almost eroded his will to survive. His return to the Laguna Pueblo reservation only increases his feeling of estrangement and alienation. While other returning soldiers find easy refuge in alcohol and senseless violence, Tayo searches for another kind of comfort and resolution.   Tayo&#039;s quest leads him back to the Indian past and its traditions, to beliefs about witchcraft and evil, and to the ancient stories of his people. The search itself becomes a ritual, a curative ceremny that defeats the most virulent of afflictions&mdash;despair.",Penguin Books,1986-03-04,,,,,260.0,2025-06-13,1,Maple,,36.0,Computers,en,False,"World War 1939-1945 -- Veterans -- Fiction, Laguna Indians -- Fiction",
book,And the Bridge Is Love,Faye Moskowitz,Faye,Moskowitz,9780807063279,807063274,,Beacon Press,1993-08-01,,,,,160.0,2025-06-13,1,Maple,Paperback,8.0,Biography & Autobiography,en,False,"Moskowitz Faye, Jewish women, Biography/Autobiography, Biography & Autobiography, Biography / Autobiography, Women, United States, Jews, Essays, General, Social Science / Ethnic Studies, Biography",6.9 ounces
book,Sweet Theft: A Poet's Commonplace Book,J.D. McClatchy,J.D.,McClatchy,9781619027138,1619027135,"Centuries ago, when books were rare, those who owned them would lend them to friends, who in turn would copy out passages they especially liked before returning the precious book to its owner. These anthologies came to be known as Commonplace Books, and modern writers as different as W. H. Auden and Alec Guinness have kept them as well, recording phrases or passages that struck them as wise or witty or quirky. The result is as much the self-portrait of a sensibility as it is a collection of miscellaneous delights. Renowned poet J. D. McClatchy has been keeping such a book for three decades now. This selection from it offers a unique look into what strange facts, what turns of mind or phrase, what glorious feats of language and nature can attract the attention of a poet.    The great and the obscure are gathered around the same table, exchanging remarkable opinions. Henry James is speaking of Venice: The deposed, the defeated, the disenchanted, the wounded, or even only the bored, have seemed to find there something that no other place could give.” At the other end of the table, Groucho Marx is playing drama critic: I didn’t like the play, but then I saw it under adverse circumstancesthe curtain was up.” Nietzsche and Flaubert, Dizzy Gillespie and Marianne Mooredozens of unexpected and timeless aphorisms and anecdotes that pierce and provoke. Many of McClatchy’s own observations about the art and prowess of writing are included as well.   This is a book meant to be sipped, not gulped; meant to be read at leisure and pondered on at length.",Counterpoint,2016-04-12,,,,,256.0,2025-06-13,1,Maple,,2.0,Literary Criticism,en,False,Commonplace-books,
book,Schindler's List,Thomas Keneally,Thomas,Keneally,9780671880316,671880314,"Winner of the Booker Prize  Winner of the Los Angeles Times Book Award for Fiction  Schindler&#039;s List is a remarkable work of fiction based on the true story of German industrialist and war profiteer, Oskar Schindler, who, confronted with the horror of the extermination camps, gambled his life and fortune to rescue 1,300 Jews from the gas chambers.  Working with the actual testimony of Schindler&#039;s Jews, Thomas Keneally artfully depicts the courage and shrewdness of an unlikely savior, a man who is a flawed mixture of hedonism and decency and who, in the presence of unutterable evil, transcends the limits of his own humanity.",Touchstone,1993-12-01,,,,,400.0,2025-06-13,1,Maple,,20.0,Fiction,en,False,"Schindler Oskar -- 1908-1974 -- Fiction, Holocaust Jewish (1939-1945) -- Fiction, World War 1939-1945 -- Fiction",
book,The Partition,Don Lee,Don,Lee,9781636140315,1636140319,"A thrilling new story collection from acclaimed writer Don Lee exploring Asian American identity, spanning decades and continents ""The Partition is flat-out brilliant: a witty, kaleidoscopic tear through questions of race and identity in America today by a writer who has wrought luminous fiction from these issues for years. Don Lee's collection offers vivid, entertaining proof that ethnicity is never straightforward or easy--no matter who we are, or where we stand."" --Jennifer Egan, Pulitzer Prize-winning author of A Visit from the Goon Squad ""Whatever you're hiding from may find you in a Don Lee story. But this isn't a warning. The Partition is, again and again, about Asian Americans in ways we don't always admit we need, a collection about how we alternately cheat and show up for each other and ourselves. And the whole time, there's a canny, shrewd love, guiding us the way through."" --Alexander Chee, author of How to Write an Autobiographical Novel Twenty-one years after the publication of his landmark debut collection Yellow, Don Lee returns to the short story form for his sixth book, The Partition. The Partition is an updated exploration of Asian American identity, this time with characters who are presumptive model minorities in the arts, academia, and media. Spanning decades, these nine novelistic stories traverse an array of cities, from Tokyo to Boston, Honolulu to El Paso, touching upon transient encounters in local bars, restaurants, and hotels. Culminating in a three-story cycle about a Hollywood actor, The Partition incisively examines heartbreak, identity, family, and relationships--the characters searching for answers to universal questions: Where do I belong? How can I find love? What defines an authentic self?",Akashic Books,2022-05-10,,,,,296.0,2025-06-13,1,Maple,,2.0,Fiction,en,False,,
book,Democracy Awakening: Notes on the State of America,Heather Cox Richardson,Heather,Richardson,9780593652961,593652967,"New York Times Bestseller “Engaging and highly accessible.”—Boston Globe “A vibrant, and essential history of America's unending, enraging and utterly compelling struggle since its founding to live up to its own best ideals… It's both a cause for hope, and a call to arms.”--Jane Mayer, author Dark Money From historian and author of the popular daily newsletter LETTERS FROM AN AMERICAN, a vital narrative that explains how America, once a beacon of democracy, now teeters on the brink of autocracy -- and how we can turn back. In the midst of the impeachment crisis of 2019, Heather Cox Richardson launched a daily Facebook essay providing the historical background of the daily torrent of news. It soon turned into a newsletter and its readership ballooned to more than 2 million dedicated readers who rely on her plainspoken and informed take on the present and past in America. In Democracy Awakening, Richardson crafts a compelling and original narrative, explaining how, over the decades, a small group of wealthy people have made war on American ideals. By weaponizing language and promoting false history they have led us into authoritarianism -- creating a disaffected population and then promising to recreate an imagined past where those people could feel important again. She argues that taking our country back starts by remembering the elements of the nation’s true history that marginalized Americans have always upheld. Their dedication to the principles on which this nation was founded has enabled us to renew and expand our commitment to democracy in the past. Richardson sees this history as a roadmap for the nation’s future. Richardson’s talent is to wrangle our giant, meandering, and confusing news feed into a coherent story that singles out what we should pay attention to, what the precedents are, and what possible paths lie ahead. In her trademark calm prose, she is realistic and optimistic about the future of democracy. Her command of history allows her to pivot effortlessly from the Founders to the abolitionists to Reconstruction to Goldwater to Mitch McConnell, highlighting the political legacies of the New Deal, the lingering fears of socialism, the death of the liberal consensus and birth of “movement conservatism.” Many books tell us what has happened over the last five years. Democracy Awakening explains how we got to this perilous point, what our history really tells us about ourselves, and what the future of democracy can be.",Viking,2023-09-26,,,,,304.0,2025-06-13,1,Maple,,2.0,History,en,False,,0.504
book,Dogbert's Top Secret Management Handbook,Scott Adams,Scott,Adams,9780887307881,887307884,"The creator of &quot;Dilbert,&quot; the fastest-growing comic strip in America (syndicated in more than 900 newspapers and read by more than 60 million people), presents a hilariously biting compilation of cartoons that expose the absurdities of corporate management. Dilbert is sweeping the nation. &quot;The San Francisco Chronicle&quot; dubbed him &quot;the cartoon hero of the workplace, &quot; saying that the strip &quot;has its finger on the pulse of the &#039;90s white-collar workplace.&quot; Now online, it is one of the hottest Web sites on the Internet, and more than a million copies of the &quot;Dilbert&quot; cartoon books have been sold. In this latest cartoon compilation, Dilbert&#039;s canine sidekick, the Machiavellian Dogbert, presents a breakthrough management manual to help bosses stick it to their employees. All too often, new managers make mistakes like rewarding good work with good pay, communicating clearly and improving departmental efficiency. Dogbert shows that this could have devastating results: Employees begin to expect fair treatment and compensation, productive workers show results (making the managers look bad by comparison) and the department&#039;s future budget allotment could be decreased because it spends only what it needs. Drawn from years of experience tormenting Dilbert and advising his boss, &quot;Dogbert&#039;s Top Secret Management Handbook&quot; uses pithy essays, whose points are illustrated with hundreds of comic strips, to drive home the lost cause of the employee in the workplace. It is the perfect gift for bosses and office workers everywhere.&quot;[Adams] turns the powerful searchlight of his intelligence on management, seeking its very essence. Think of him as Peter Drucker with fleas.&quot; &quot;--Fortune&quot; &quot;I am nowconvinced 98% of the managers I&#039;ve worked for have read this book and taken Dogbert&#039;s advice.&quot; &quot;--USA Today&quot;",Harper Business,1996-10-08,,,,,163.0,2025-06-13,1,Maple,,12.0,Humor,en,False,"Supervision of employees -- Humor, Executives -- Humor, Personnel management -- Humor, Supervision of employees -- Caricatures and cartoons, Executives -- Caricatures and cartoons, Personnel management -- Caricatures and cartoons",
book,Jack London: Tales of the North,Jack London,Jack,London,9780785813316,785813314,"If you enjoy nonstop adventure and heroic exploits, then you are sure to love Tales of the North. This masterful compilation includes - in facsimile of the original turn-of-the-century magazines-the complete novels of White Fang, The Sea Wolf, The Call of the Wild, and Cruise of the Dazzler, plus fifteen short stories- all with original illustrations. This is an adventure you won&#039;t want to miss!",Book Sales,1979-01-01,,,,,488.0,2025-06-13,1,Maple,Paperback,11.0,Fiction,en,False,"General & Literary Fiction, Short stories, Literary, Literature - Classics / Criticism, Fiction, Action & Adventure, Sale Books, Classics",1.8 pounds
book,Sozaboy,Ken Saro-Wiwa,Ken,Saro-Wiwa,9780582236998,582236991,"Sozaboy describes the fortunes of a young naive recruit in the Nigerian Civil War: from the first proud days of recruitment to the disillusionment, confusion and horror that follows. The author's use of 'rotten English' - a mixture of Nigerian pidgin English, broken English and idiomatic English - makes this a unique and powerful novel.",Pearson,1995-04-28,,,,,188.0,2025-06-13,1,Maple,,8.0,Fiction,en,False,Nigeria -- History -- Civil War 1967-1970 -- Fiction,
book,Alofa.,Sia Figiel,Sia,Figiel,9783293202061,3293202063,,Unionsverlag,2001-08-01,,,,,,2025-06-13,1,Maple,Paperback,7.0,,de,False,,8.5 ounces
book,"The Wonder Weeks: How to Stimulate Your Baby's Mental Development and Help Him Turn His 10 Predictable, Great, Fussy Phases into Magical Leaps Forward","Frans  X. Plooij, Hetty van de Rijt",Frans,Plooij,9789491882166,9491882163,"―The worldwide bestseller and multiple award winning―The Wonder Weeks. How to stimulate your baby's mental development and help him turn his 10 predictable, great, fussy phases into magical leaps forward describes the incredible mental developmental changes (leaps) and regression periods that all babies go through. Understanding the real reason behind crying, eating and sleeping problems is the only real solution every parent needs. The Wonder Weeks reveals what's going on inside baby's mind. Including a bonus chapter with everything about the relationship between sleep and leaps, as well as unique insight into your baby's sleeping behavior.The book includes:Week-by-week guide to baby's behaviorWhen to expect the fussy behavior, what this implies (cranky, clingy, crying (the three C's) behavior) and how to deal with these regression periods (leaps)A description from your baby's perspective of the world around him and how you can understand the changes he's going throughFun games and gentle activities you can do with your childUnique insight into your baby's sleeping behaviourThe book is based on the scientific- and parental-world-changing discovery of a phenomenon: all normal, healthy babies appear to be more fussy at very nearly the same ages, regression periods, and sleep less in these phases.These age-related fluctuations in need for body contact and attention (regression periods) are related to major and quite dramatic changes in the brains of the children. These changes enable a baby to enter a whole new perceptual world and, as a consequence, to learn many new skills. This should be a reason for celebration, but as far as the baby is concerned these changes are bewildering. He's taken aback―everything has changed overnight. It is as if he has woken up on a strange planet. He needs you to guide him and understand what he is going through! Get ready to rediscover the world all over again with your baby… Bonus: Sleep, and the lack of sleep... that's something we all have to deal with when we have a baby. The bonus chapter includes everything about the relationship between sleep and leaps, as well as unique insight into your baby's sleeping behavior. Hint: did you know your baby learns (and there's a lot of brain activity) during those little, 'light' sleeps?",Kiddy World Publishing,2017-09-05,,,,,510.0,2025-06-13,1,Maple,,10.0,Family & Relationships,en,False,"Development, Newborn infants, Psychology, Infants, Infant psychology, Child rearing",
book,Trance after Breakfast,Alan Cheuse,Alan,Cheuse,9781402215162,1402215169,"A collection of lyrical travel writings from celebrated writer and NPR commentator Alan Cheuse. Along with luggage and tickets, we always travel with that which it is impossible to leave behind: ourselves, our spirits, our souls. By definition the best travel writing carries us on a soul-journey, the sort of trip that dramatizes how the heart learns about its place in the world. In A Trance After Breakfast, poetic wanderer and novelist (To Catch the Lightning) Alan Cheuse has crafted a collection that masterfully exceeds such standards. He lures the reader around the world, from Bali and New Zealand to Mexico and back home again to his native New Jersey, making the foreign familiar and the familiar slightly foreign. Collected from such celebrated publications as Gourmet, the Antioch Review, and the San Diego Reader, the dispatches in A Trance After Breakfast will enchant, captivate, and transport readers.","Sourcebooks, Incorporated",2009-06-01,,,,,272.0,2025-06-13,1,Maple,,10.0,Voyages and travels,en,False,"Cheuse Alan -- Travel, Voyages and travels",
book,The Canary Islands: A Cultural History (Landscapes of the Imagination),Peter Stone,Peter,Stone,9781908493996,1908493992,"The seven volcanic Canary Islands that bask in the Atlantic off shore from the north-west African coast have long had legendary connotations. To the Greeks they were the Gardens of the Hesperides, blessed with a perennial spring-like climate, while the Carthaginians christened them the 'Purple Isles' on account of the rich dye material they obtained there. Inhabitants have ranged from the early Berber-descended Guanches, of whom cultural traces still remain, to the rich blend of European and Latin peoples that evolved after the Spanish conquest in the fifteenth-century. Famous visitors have included Columbus, Humboldt and General Franco, who famously flew from Gran Canaria in a (British-piloted) Dragon Rapide in 1936 to launch Spain's Civil War. In today's cosmopolitan capitals of Las Palmas and Santa Cruz de Tenerife Spanish colonial-era buildings merge with modern centres equipped with sophisticated amenities. For holidaymakers tiny ecologically-oriented havens like Gomera vie with big brash tourist resorts like Playa del Ingles and Playa de las Americas, today's major money-makers after the brief trade boom of yesteryear. Peter Stone explores the fascinating history and culture of this archipelago, where nature and geology provide a spectacular setting for today's tourism industry. FANTASY LANDSCAPE Bone dry 'badlands', orange-grey dunes, giant craters, frozen lava flows, black-sanded coves, rich green bananas plantations and sylvan woodlands shrouded in perennial mists all form part of this multi-faceted paradise. NATIONAL PARKS AND WILD LIFE Four of Spain's fifteen great national parks are located on the islands; Tenerife's 3,700-metre Teide, the country's highest mountain, is the most visited. Island fauna vary from the desert-like lizards of Lanzarote to the rich bird life of La Palma. UNIQUE LOCAL CULTURE Local fiestas abound and traditional dance and music exhibitions are held in cultural centres like Gran Canaria's Pueblo Canario. Mould-breaking Lanzarote architect Cesar Manrique has left a supreme legacy of innovative buildings and monuments.",Signal Books,2014-09-25,,,,,256.0,2025-06-16,1,Antrim,,15.0,Canary Islands,en,False,"History, Civilization",
book,"Get Out of My Life, but First Could You Drive Me & Cheryl to the Mall: A Parent's Guide to the New Teenager, Revised and Updated",Anthony E. Wolf,Anthony,Wolf,9780374528539,374528535,"A brand new edition of the bestselling guide to raising teenagersWhen Anthony E. Wolf's witty and compassionate guide to raising adolescents was first published, its amusing title and fresh approach won it widespread admiration. Beleaguered parents breathed sighs of relief and gratitude. Now Dr. Wolf has revised and updated his bestseller to tackle the changes of the past decade. He points out that while the basic issues of adolescence and the relationships between parents and their children remain much the same, today's teenagers navigate a faster, less clearly anchored world. Wolf's revisions include a new chapter on the Internet, a significantly modified section on drugs and drinking, and an added piece on gay teenagers. Although the rocky and ever-changing terrain of contemporary adolescence may bewilder parents, Get Out of My Life gives them a great road map.","Farrar, Straus and Giroux",2002-08-01,,,,,240.0,2025-06-16,1,Antrim,,10.0,Family & Relationships,en,False,"Parent and teenager -- United States., Adolescence.",
book,The Last Word: An Autobiography,Quentin Crisp,Quentin,Crisp,9780692968482,692968482,"The Last Word is the third and final installment of Quentin Crisp's autobiography. The Last Word was written by Crisp with the help of his best friend, Phillip Ward, who tape-recorded and later transcribed Quentin’s words between 1997-1999. The Last Word was published on November 21, 2017, the eighteen-year anniversary of Crisp's passing.",MB Books LLC,2017-11-07,,,,,232.0,2025-06-16,1,Antrim,,2.0,,en,False,"Artists' models, Gay authors, Gay men, Storytellers, Gay actors, Biography",
