item_type,title,creators,first_name,last_name,ean_isbn13,upc_isbn10,description,publisher,publish_date,group,tags,notes,price,length,added,copies,collection,physical_format,revision,categories,language,public_domain,subjects,weight
book,Chicka Chicka Boom Boom (Classic Board Books),"Bill Martin Jr., John Archambault",Bill,Jr.,9781442450707,1442450703,"The complete edition of the bestselling children&rsquo;s favorite, Chicka Chicka Boom Boom, is now available as a Classic Board Book!A told B and B told C,&ldquo;I&rsquo;ll meet you at the topof the coconut tree.&rdquo;&nbsp;&nbsp;&nbsp;&nbsp; When all the letters of the alphabet race one another up the coconut tree, will there be enough room?Of course there is always enough room for this rollicking alphabet chant that has been a children&rsquo;s favorite for more than twenty years! Bill Martin Jr and John Archambault&rsquo;s rhythmic text keeps the beat with Caldecott Honor illustrator Lois Ehlert&rsquo;s bold, cheerful art. This winning combination has created a series of enduring Chicka Chicka favorites, and now, for the first time ever, the complete edition of the original Chicka Chicka Boom Boom story is available as a Classic Board Book. With sturdy pages and rounded corners, this portable edition of an irresistible alphabet romp will delight a new generation of young readers.",Little Simon,2012-08-28,,,,,36.0,2025-06-19,1,Woodbine,Paperback,10.0,Juvenile Nonfiction,en,False,,
book,Ten Gators in the Bed,Johnette Downing,Johnette,Downing,9781941879023,1941879020,"True to her Louisiana culture, Johnette brings readers deep into the swamp where ten gators pile into bed in their Acadian home. Based on a familiar tune, this singing book, with vibrant foam and paper illustrations, is a perfect counting and bedtime story for babies and gators - who find out who gets to sleep in the bed and who has to sleep in the swamp!",River Road Press,2015-10-01,,,,,,2025-06-19,1,Woodbine,,1.0,Alligators,en,False,"Children's fiction, Family",0.014
book,The Bible App For Kids Storybook Bible,YouVersion in partnership with OneHope Inc.,YouVersion,Inc.,9781630490652,1630490652,"The Bible App for Kids Storybook Bible is an all–new, delight–filled Bible experience designed to help your children fall in love with God's Word. Based on the most downloaded Bible story app in the world, the Bible App for Kids Storybook Bible brings the Bible to life for your whole family, with colorful illustrations and engaging storytelling. You'll thrill to see God part the Red Sea for Moses and the Israelites as they flee their Egyptian pursuers. When the baby Jesus is born, you'll rejoice with the angels as they fill the sky to herald his birth. You'll marvel as Jesus feeds five thousand people, miraculously multiplying five loaves and two fishes offered by a little boy. The Bible App for Kids Storybook Bible features 28 quintessential Bible stories that are easily understood by children but enjoyed by entire families.  BibleAppforKids.com","YouVersion and OneHope, Inc./ Winters Publishing Group",2015-10-13,,,,,416.0,2025-06-19,1,Woodbine,hardcover,3.0,Juvenile Nonfiction,en,False,,
book,"Payback (Stephen Coonts' Deep Black, Book 4)","Stephen Coonts, Jim DeFelice",Stephen,Coonts,9780312936983,312936982,"RECRUITED:A crack team of cover agents.Word is out to ex-Marine sniper Charlie Dean and his team of the National Security Agency: Infiltrate the highest stratum of Peruvian political power and derail a renegade general from acing an election. All Dean has to do is find a way inside an impenetrable bank vault protected by armed guards round the clock&ndash;it&rsquo;s all in a day&rsquo;s work for the men and women of Deep Black.ENGAGED:A violent political coupBut things get complicated when Dean and company discover the renegade general&rsquo;s second plot. The military madman&rsquo;s ruse&mdash;a nuclear weapon he claims is in the hands of Marxist guerillas, a bomb that only he can rescue&hellip;and control.IGNITED:A devastating terrorist plot.When the general and his plot are exposed, the NSA concludes the greatest threat is over. But in fact, it&rsquo;s only just beginning&hellip;",St. Martin's Paperbacks,2005-10-04,,,,,480.0,2025-06-19,1,Woodbine,,10.0,Fiction,en,False,"Intelligence officers -- Fiction, Undercover operations -- Fiction, National security -- Fiction, Cyberterrorism -- Fiction",
book,Gem Squash Tokoloshe,Rachel Zadok,Rachel,Zadok,9780330441193,330441191,"She just sat there hardly moving, staring at the drive. Black marks formed under her eyes where her lashes bled their waxy coating onto her skin. Her rouged cheeks were smudged. Mother looked like she was melting in the heat. Faith leads an isolated existence on her family&#039;s drought stricken farm in the Northern Transvaal of South Africa. When the rain stopped, her father took to the road as a travelling salesman, returning only at weekends. Now Faith lives with her mother Bella and dog Boesman anticipating his visits - until one day he stops coming and Bella&#039;s health begins to go into rapid decline. Fifteen years later Bella has died incarcerated in the Sterkfontein asylum for the criminally insane. Faith has not spoken to her mother for ten years and is on the brink of a breakdown of her own. Now, with her mother&#039;s death, she inherits the farm and must return to confront the dark mysteries of the past...In prose as lithe and imaginative as that of Alexandra Fuller, Rachel Zadok te Riele recreates the voice of a young girl growing up during the height of apartheid unrest in South Africa.As Faith struggles to make sense of the complex world in which she lives and come to terms with the beliefs her society and upbringing have inculcated in her, what emerges is a richly compelling, emotionally resonant tale of courage set against the backdrop of a chaotically divided and deeply beautiful country.",Pan Books,2005-09-16,,,,,320.0,2025-06-19,1,Woodbine,Paperback,9.0,Apartheid,en,False,Modern fiction,7.8 ounces
book,Preggatinis: Mixology for the Mom-to-Be,Natalie Bovis Nelsen,Natalie,Nelsen,9781599214542,1599214547,"Within these pages are 75 original Preggatini recipes highlighting fresh juices, herbs, and garnishes as well as ideas for Preggatini Parties&mdash;a modern spin on the humdrum baby shower.",GPP Life,2009-01-13,,,,,160.0,2025-06-19,1,Woodbine,,10.0,Cooking,en,False,"Non-alcoholic cocktails, Pregnant women",
book,I Am Not Okay with This,Charles Forsman,Charles,Forsman,9781683963318,1683963318,"Sydney seems like a normal, rudderless fifteen-year-old freshman. She hangs out underneath the bleachers, blasts music in her friend's car, and gets into arguments with her annoying little brother. But she also has a few secrets she's only shared in her diary: how she's in love with her best friend, the bizarre death of her war veteran father, and excruciatingly painful telekinetic powers that keep popping up at the most inopportune times. Charles Forsman once again expertly channels teenage ethos in a style that evokes classic comics strips while telling a powerful story about the intense, and sometimes violent, tug of war between trauma and control. I Am Not Okay With This tackles familial strain, sexual confusion, and PTSD in Forsman's signature straight-faced-but-humorous style and firmly stakes his place among the world's best cartoonists.",,2020-02-03,,,,,176.0,2025-06-19,1,Woodbine,,2.0,Comics & Graphic Novels,en,False,,
book,Kismet: A Kayankaya Thriller (4) (Melville International Crime),Jakob Arjouni,Jakob,Arjouni,9781935554233,1935554239,"“Kemal Kayankaya is the ultimate outsider among hard-boiled private eyes.”—Marilyn Stasio, The New York Times Book ReviewOVER 1 MILLION COPIES SOLD WORLDWIDE   As a Turkish immigrant raised by Germans, he's regularly subjected to racism in the gritty, working-class city, and getting work isn't easy. So when his friend Romario asks Kayankaya to protect him against thugs demanding protection money from his restaurant business, the down-and-out Kayankaya takes the job.  Except these are no ordinary thugs. They turn out to be battle-hardened Croatian nationalists looking to take over the rackets in Frankfurt, and they do not take kindly to Kayankaya's interference with their plans. But try as he might, Kayankaya just can't seem to stay out of their way … What ensues is a brilliant novel about organized crime, immigration, the fallout from the Balkan wars, and the madness of nationalism from one of Europe's finest crime writers.",Melville International Crime,2010-10-05,,,,,255.0,2025-06-19,1,Woodbine,,6.0,Fiction,en,False,,
book,"Without You: A Memoir of Love, Loss, and the Musical Rent",Anthony Rapp,Anthony,Rapp,9780743269773,743269772,"Anthony Rapp had a special feeling about Jonathan Larson&#039;s rock musical Rent as early as his first audition, which won him a starring role as the video artist Mark Cohen. The Pulitzer Prize-winning Rent opened to thunderous acclaim off-Broadway -- but even as friends and family were celebrating the show&#039;s first success, they were also mourning Jonathan Larson&#039;s sudden death from an aortic aneurysm. And when Anthony&#039;s mom began to lose her battle with cancer, Anthony found himself struggling to balance his life in the theater with his responsibility to his family.   In Without You, Anthony tells of his exhilarating journey with the cast and crew of Rent as well as the intimacies of his personal life behind the curtain. Marked by fledgling love and devastating loss, Without You is an exceptional memoir of the world of theater, the love of a son for his mother, and maturity won far too early.",Simon & Schuster,2006-10-31,,,,,320.0,2025-06-19,1,Woodbine,paperback,2.0,Biography & Autobiography,en,False,,
book,Caught,Harlan Coben,Harlan,Coben,9780525951582,52595158,"From the #1 New York Times bestselling master of suspense comes a fast-paced, emotion-packed novel about guilt, grief, and our capacity to forgive  17-year-old Haley McWaid is a good girl, the pride of her suburban New Jersey family, captain of the lacrosse team, headed off to college next year with all the hopes and dreams her doting parents can pin on her. Which is why, when her mother wakes one morning to find that Haley never came home the night before, and three months quickly pass without word from the girl, the community assumes the worst.  Wendy Tynes is a reporter on a mission, to identify and bring down sexual predators via elaborate&mdash;and nationally televised&mdash;sting operations. Working with local police on her news program Caught in the Act, Wendy and her team have publicly shamed dozens of men by the time she encounters her latest target. Dan Mercer is a social worker known as a friend to troubled teens, but his story soon becomes more complicated than Wendy could have imagined.  In a novel that challenges as much as it thrills, filled with the astonishing tension and unseen suburban machinations that have become Coben&rsquo;s trademark, Caught tells the story of a missing girl, the community stunned by her loss, the predator who may have taken her, and the reporter who suddenly realizes she can&rsquo;t trust her own instincts about this story&mdash;or the motives of the people around her. Praise for Long Lost:  &quot;Coben is one of the best authors around at writing page-turning suspense, as  Long Lost makes clear.&quot;  -Chicago Sun-Times  &quot;Roller-coaster plot and savvy dialogue...All the ingredients of a good old- fashioned thriller: murder, action and wit.&quot;  -New York Daily News",Dutton Adult,2010-03-23,,,,,400.0,2025-06-19,1,Woodbine,,5.0,Fiction,en,False,,
book,The Princess and the Goblin,George MacDonald,George,MacDonald,9781591667995,1591667992,"One night, Princess Irene discovers her beautiful great-great-grandmother spinning silver thread in the palace tower. Though great danger is about to come upon the sunny kingdom, the old lady promises",BJU Press,2007-08-01,,,,,191.0,2025-06-19,1,Woodbine,Paperback,13.0,Juvenile Fiction,en,False,Fairy tales,
book,"Always and Forever, Lara Jean (To All the Boys I've Loved Before)",Jenny Han,Jenny,Han,9781481430494,1481430491,"“Sweetly funny.” —Entertainment Weekly New York Times bestselling author Lara Jean’s letter-writing days aren’t over in this surprise follow-up to the bestselling To All the Boys I’ve Loved Before and P.S. I Still Love You.Lara Jean is having the best senior year a girl could ever hope for. She is head over heels in love with her boyfriend, Peter; her dad’s finally getting remarried to their next door neighbor, Ms. Rothschild; and Margot’s coming home for the summer just in time for the wedding. But change is looming on the horizon. And while Lara Jean is having fun and keeping busy helping plan her father’s wedding, she can’t ignore the big life decisions she has to make. Most pressingly, where she wants to go to college and what that means for her relationship with Peter. She watched her sister Margot go through these growing pains. Now Lara Jean’s the one who’ll be graduating high school and leaving for college and leaving her family—and possibly the boy she loves—behind. When your heart and your head are saying two different things, which one should you listen to?",Simon &amp; Schuster Books for Young Readers,2018-04-10,,,,,336.0,2025-06-19,1,Woodbine,,16.0,Young Adult Fiction,en,False,"Juvenile fiction, Weddings, Love, Dating (Social customs), Fiction",
book,Long Lost (Myron Bolitar),Harlan Coben,Harlan,Coben,9780525951056,525951059,"Harlan Coben&#039;s millions of fans have waited three long years for a new Myron Bolitar novel and soon their patience will be rewarded in spectacular fashion. Myron hasn&#039;t heard from Terese Collins in years. Not since their affair ended without explanation. He&#039;s had no contact with her since, so her call catches him off guard. She&#039;s in Paris, she says, in trouble and only Myron can help. Terese tells him a sad story she&#039;s never before revealed: a good marriage, her struggles to get pregnant, the happiest moment of her life when her only child was born, the day everything she&#039;d ever loved was taken from her. As the years passed Terese heard nothing from her ex-husband, until the phone call that brought her to Paris. But on arrival, Terese finds her husband has been murdered, leaving her as a prime suspect. Then comes a startling piece of evidence that turns the entire case upside down, laying bare Terese&#039;s long-buried family secrets in the most shocking way and leaving Myron nowhere to turn for help. Caught in a foreign landscape where nothing is as it seems, he must tear apart the city - and eventually the globe - fighting for answers to unfathomable questions that will take Myron, and Harlan Coben&#039;s readers, where they have never gone before.",Dutton Adult,2009-03-31,,,,,384.0,2025-06-19,1,Woodbine,,7.0,Fiction,en,False,,
book,Blow Fly,Patricia Cornwell,Patricia,Cornwell,9780399150890,399150897,"The world&#039;s number-one-bestselling crime writer is back with another scorching thriller featuring medical examiner Dr. Kay Scarpetta.  Dr. Kay Scarpetta has left Virginia in quest of peace but instead finds herself drawn into baffling, horrific murders in Florida. There she becomes entangled in an international conspiracy that confronts her with the shock of her life.",Putnam,2003-10-13,,,,,465.0,2025-06-19,1,Woodbine,,28.0,Fiction,en,False,"Scarpetta Kay (Fictitious character) -- Fiction, Forensic pathologists -- Fiction, Death row inmates -- Fiction, Women physicians -- Fiction, Psychopaths -- Fiction, Louisiana -- Fiction, Florida -- Fiction",
book,Deadly Election: A Flavia Albia Mystery (Flavia Albia Series),Lindsey Davis,Lindsey,Davis,9781250063984,1250063981,"In the blazing July heat of imperial Rome, Flavia Albia inspects a decomposing corpse. It has been discovered in lots to be auctioned by her family business, so she's determined to identify the dead man and learn how he met his gruesome end. The investigation will give her a chance to work with the magistrate, Manlius Faustus, the friend she sadly knows to be the last chaste man in Rome. But he's got other concerns than her anonymous corpse. It's election time and with democracy for sale at Domitian's court, tension has come to a head. Faustus is acting as an agent for a 'good husband and father', whose traditional family values are being called into question. Even more disreputable are his rivals, whom Faustus wants Albia to discredit. As Albia's and Faustus' professional and personal partnership deepens they have to accept that, for others, obsession can turn sour, and become a deadly strain that leads, tragically, to murder.",Minotaur Books,2015-07-14,,,,,320.0,2025-06-19,1,Woodbine,,5.0,Fiction,en,False,"Murder, Investigation, Women private investigators, Fiction",
book,Recreating Your Self: Building Self-Esteem Through Imaging and Self-Hypnosis,Nancy J. Napier,Nancy,Napier,9780393312430,393312437,"&quot;This compelling and considerate guide very gently yet powerfully shows the adult child how to develop a strong and solid sense of self.&quot;&mdash;Emily J. Marlin, C.S.W. For people who were emotionally and physically wounded as children, the journey from childhood to adulthood is a constant struggle with shame, self-criticism, and fear. This book shows these adult children of dysfunctional families how to use self-hypnosis to resolve the effects of abuse, to build a healing relationship with the child within and an inspiring one with the future self, and to give back &quot;hand-me-downs&quot; that are causing pain. The author&#039;s stories and hypnotic strategies emphasize self-acceptance, healing old wounds, and getting on with life. Explicit exercises and self-hypnotic scripts, clearly explained and set within a framework that enables readers to make sense of their experiences, give people the tools they need to create a resilient, healthy self.",W. W. Norton & Company,1996-06-17,,,,,288.0,2025-06-19,1,Woodbine,,12.0,Family & Relationships,en,False,,
book,Finding a Career That Works for You: A Step-by-Step Guide to Choosing a Career,Wilma Fellman,Wilma,Fellman,9781886941632,1886941637,"Updated with the latest research, this guide is essential for people who are in the process of choosing a career and finding a job. By teaching how to better understand one&rsquo;s interests, aptitudes, personality, and goals, practical tips are provided on how to find a job in a chosen fieldwhere to search for available jobs, the best ways to prepare a resume, how to write a cover letter, and how to make the best impression during a job interview. Filled with personal stories of people who have found work they love despite potentially overwhelming challenges, this book is a road map to finding the perfect career.",Specialty Press/A.D.D. Warehouse,2006-09-01,,,,,212.0,2025-06-19,1,Woodbine,Paperback,10.0,Business & Economics,en,False,"Advice on careers & achieving success, Business & Economics, Careers / Job Opportunities, Career/Job, Business & Economics / Careers, Careers - General, United States, Vocational guidance",12.8 ounces
book,The Group Therapy Treatment Planner,"Kim Paleg, Arthur E. Jongsma Jr.",Kim,Paleg,9780471667919,471667919,"The Group Therapy Treatment Planner, Second Edition provides all the elements necessary to quickly and easily develop formal treatment plans that satisfy the demands of HMOs, managed care companies, third-party payors, and state and federal review agencies. A critical tool for mental health professionals developing formal treatment plans for working with a variety of groups New edition features expanded coverage and outlines entirely new areas including utilizing group therapy to treat panic/agoraphobia, PTSD/trauma, adult ADHD, obsessive-compulsive disorder, and borderline personality disorder Streamlined interventions and fully updated language make this edition easier to use and more clinically applicable Saves you hours of time-consuming paperwork, yet offers the freedom to develop customized treatment plans Organized around 33 main presenting problems with a focus on applying a group therapy approach to a wide variety of disorders Over 1,000 well-crafted, clear statements describe the behavioral manifestations of each relational problem, long-term goals, short-term objectives, and clinically tested treatment options Easy-to-use reference format helps locate treatment plan components by behavioral problem or DSM-IV-TR diagnosis Includes a sample treatment plan that conforms to the requirements of most third-party payors and accrediting agencies (including HCFA, JCAHO, and NCQA)",Wiley,2005-01-17,,,,,336.0,2025-06-19,1,Woodbine,,11.0,Psychology,en,False,,
book,Verity,Colleen Hoover,Colleen,Hoover,9781538724736,1538724731,"A ""sublimely creepy"" psychological thriller from #1 New York Times bestselling author Colleen Hoover (Tarryn Fisher, New York Times bestselling author). Lowen Ashleigh is a struggling writer on the brink of financial ruin when she accepts the job offer of a lifetime. Jeremy Crawford, husband of bestselling author Verity Crawford, has hired Lowen to complete the remaining books in a successful series his injured wife is unable to finish.   Lowen arrives at the Crawford home, ready to sort through years of Verity's notes and outlines, hoping to find enough material to get her started. What Lowen doesn't expect to uncover in the chaotic office is an unfinished autobiography Verity never intended for anyone to read. Page after page of bone-chilling admissions, including Verity's recollection of the night her family was forever altered.   Lowen decides to keep the manuscript hidden from Jeremy, knowing its contents could devastate the already grieving father. But as Lowen's feelings for Jeremy begin to intensify, she recognizes all the ways she could benefit if he were to read his wife's words. After all, no matter how devoted Jeremy is to his injured wife, a truth this horrifying would make it impossible for him to continue loving her.",Grand Central Publishing,2021-10-26,,,,,336.0,2025-06-18,1,Hudson,,1.0,Fiction,en,False,,
book,"Guns, Germs, and Steel: The Fates of Human Societies",Jared M. Diamond,Jared,Diamond,9780393317558,393317552,"Winner of the Pulitzer Prize.In this ""artful, informative, and delightful"" (William H. McNeill, New York Review of Books) book, Jared Diamond convincingly argues that geographical and environmental factors shaped the modern world. Societies that had had a head start in food production advanced beyond the hunter-gatherer stage, and then developed religion --as well as nasty germs and potent weapons of war --and adventured on sea and land to conquer and decimate preliterate cultures. A major advance in our understanding of human societies, Guns, Germs, and Steel chronicles the way that the modern world came to be and stunningly dismantles racially based theories of human history. Winner of the Pulitzer Prize, the Phi Beta Kappa Award in Science, the Rhone-Poulenc Prize, and the Commonwealth club of California's Gold Medal.",W. W. Norton & Company,1999-04-01,,,,,496.0,2025-06-18,1,Hudson,,7.0,History,en,False,,
book,The Forgotten Girls,Sara Blaedel,Sara,Blaedel,9781455581511,1455581518,"Sara Blaedel--Denmark's ""Queen of Crime""--brings her #1 bestseller THE FORGOTTEN GIRLS to North America.THE FORGOTTEN GIRLSFour days later, Louise Rick still had no answers. The body of an unidentified woman was discovered in a local forest. A large, unique scar on one side of her face should have made the identification easy, but nobody has reported her missing. As the new commander of the Missing Persons Department, Louise risks involving the media by releasing a photo of the victim, hoping to find someone who knew her.Louise's gamble pays off: an older woman phones to say that she recognizes the woman as Lisemette, a child she once cared for in the state mental institution many years ago. Lisemette, like the other children in the institution, was abandoned by her family and branded a ""forgotten girl."" But Louise soon discovers something more disturbing: Lisemette had a twin, and both girls were issued death certificates more than thirty years ago. Aided by her friend journalist Camilla Lind, Louise finds that the investigation takes a surprising and unsettling turn when it brings her closer to her childhood home. And as she uncovers more crimes that were committed--and hidden--in the forest, she is forced to confront a terrible link to her own past that has been carefully concealed.",Grand Central Publishing,2015-10-06,,,,,352.0,2025-06-18,1,Hudson,,9.0,Fiction,en,False,"Detectives, Murder, Investigation, Missing persons, Policewomen, Fiction",
