item_type,title,creators,first_name,last_name,ean_isbn13,upc_isbn10,description,publisher,publish_date,group,tags,notes,price,length,added,copies,collection,physical_format,revision,categories,language,public_domain,subjects,weight
book,All Adults Here,Emma Straub,Emma,Straub,9781594634697,1594634696,"AN INSTANT NEW YORK TIMES BESTSELLER A TODAY SHOW #ReadWithJenna BOOK CLUB PICK! ""In a time when all we want is hope, it’s a beautiful book to reach for."" -Jenna Bush Hager ""Brimming with kindness, forgiveness, humor and love and yet (magically) also a page turner that held me captive until it was finished. This is Emma Straub's absolute best and the world will love it. I love it."" —Ann Patchett “An immensely charming and warmhearted book. It’s a vacation for the soul.”—Vox A warm, funny, and keenly perceptive novel about the life cycle of one family--as the kids become parents, grandchildren become teenagers, and a matriarch confronts the legacy of her mistakes. From the New York Times bestselling author of Modern Lovers and The Vacationers, and the forthcoming novel This Time Tomorrow. When Astrid Strick witnesses a school bus accident in the center of town, it jostles loose a repressed memory from her young parenting days decades earlier. Suddenly, Astrid realizes she was not quite the parent she thought she'd been to her three, now-grown children. But to what consequence? Astrid's youngest son is drifting and unfocused, making parenting mistakes of his own. Her daughter is pregnant yet struggling to give up her own adolescence. And her eldest seems to measure his adult life according to standards no one else shares. But who gets to decide, so many years later, which long-ago lapses were the ones that mattered? Who decides which apologies really count? It might be that only Astrid's thirteen-year-old granddaughter and her new friend really understand the courage it takes to tell the truth to the people you love the most. In All Adults Here, Emma Straub's unique alchemy of wisdom, humor, and insight come together in a deeply satisfying story about adult siblings, aging parents, high school boyfriends, middle school mean girls, the lifelong effects of birth order, and all the other things that follow us into adulthood, whether we like them to or not.",Riverhead Books,2020-05-05,,,,,368.0,2025-06-19,1,Spring Hill Terrace,Hardcover,6.0,Fiction,en,False,,
book,Displacement,Kiku Hughes,Kiku,Hughes,9781250193537,1250193532,"Kiku is on vacation in San Francisco when suddenly she finds herself displaced to the 1940s Japanese-American internment camp that her late grandmother, Ernestina, was forcibly relocated to during World War II. These displacements keep occurring until Kiku finds herself ""stuck"" back in time. Living alongside her young grandmother and other Japanese-American citizens in internment camps, Kiku gets the education she never received in history class. She witnesses the lives of Japanese-Americans who were denied their civil liberties and suffered greatly, but managed to cultivate community and commit acts of resistance in order to survive. Kiku Hughes weaves a riveting, bittersweet tale that highlights the intergenerational impact and power of memory.",First Second,2020-08-18,,,,,288.0,2025-06-19,1,Spring Hill Terrace,paperback,4.0,Young Adult Fiction,en,False,,
book,Bringing Your Soul to Work: An Everyday Practice,"Cheryl Peppers, Alan Briskin",Cheryl,Peppers,9781576751114,1576751112,"People have begun to expect more from their jobs than Dilbertesque monotony. Bringing Your Soul to Work links ideas about the soul directly to the realities of the workplace, offering a path for growth and positive change in sync with the job a person already has. The authors explore ways to connect the true self with the demands and sacrifices required by a career and offer insight on maintaining inner faith in the face of tensions, contradictions, and cynicism. Readers are invited to investigate the darker aspects of their personality for a greater understanding of the vast richness of their interior world. Both inspirational and practical, this book is for anyone seeking to bridge their spiritual values with work, willing to explore unknown elements of their personality, and interested in discovering new perspectives.",Berrett-Koehler Publishers,2000-08-30,,,,,260.0,2025-06-19,1,Spring Hill Terrace,Paperback,15.0,Religion,en,False,"Office & workplace, Organizational theory & behaviour, Work & labour, Religious life, General, Careers - General, Business & Economics, Religion - Inspirational/Spirituality, Religious aspects, Career/Job, Religion in the workplace, Inspirational - General, Christian Life - General, Inspirational, Spirituality - General, Business & Economics / Business Ethics, Business & Economics/General, Religion / Inspirational/Spirituality, Religion / Spirituality, Religion/Christian Life - General, Religion/Inspirational, Religious Orientation/Christian, Employees",12.6 ounces
book,"Immigrant, Montana: A novel",Amitava Kumar,Amitava,Kumar,9780525520757,0525520759,"The author of the widely praised Lunch with a Bigot now gives us a remarkable novel--reminiscent of Teju Cole, W. G. Sebald, John Berger--about a young new immigrant to the United States in search of love: across dividing lines between cultures, between sexes, and between the particular desires of one man and the women he comes to love.The young man is Kailash, from India. His new American friends call him Kalashnikov, AK-47, AK. He takes it all in his stride: he wants to fit in--and more than that, to shine. In the narrative of his years at a university in New York, AK describes the joys and disappointments of his immigrant experience; the unfamiliar political and social textures of campus life; the indelible influence of a charismatic professor--also an immigrant, his personal history as dramatic as AK's is decidedly not; the very different natures of the women he loved, and of himself in and out of love with each of them. Telling his own story, AK is both meditative and the embodiment of the enthusiasm of youth in all its idealism and chaotic desires. His wry, vivid perception of the world he's making his own, and the brilliant melding of story and reportage, anecdote and annotation, picture and text, give us a singularly engaging, insightful, and moving novel--one that explores the varieties and vagaries of cultural misunderstanding, but is, as well, an impassioned investigation of love.",Knopf,2018-07-31,,,,,320.0,2025-06-19,1,Spring Hill Terrace,hardcover,5.0,FICTION,en,False,"Self-realization, East Indians, College students, Immigrants, Young men, Fiction",
book,The Girl on the Train (Movie Tie-In),Paula Hawkins,Paula,Hawkins,9780735212169,0735212163,"The #1 New York Times Bestseller, USA Today Book of the Year, soon to be a major motion picture starring Emily Blunt. The debut psychological thriller that will forever change the way you look at other people's lives. “Nothing is more addicting than The Girl on the Train.”—Vanity Fair“The Girl on the Train has more fun with unreliable narration than any chiller since Gone Girl. . . . [It] is liable to draw a large, bedazzled readership.”—The New York Times “Marries movie noir with novelistic trickery. . . hang on tight. You'll be surprised by what horrors lurk around the bend.”—USA Today “Like its train, the story blasts through the stagnation of these lives in suburban London and the reader cannot help but turn pages.”—The Boston Globe“Gone Girl fans will devour this psychological thriller.”—People   EVERY DAY THE SAMERachel takes the same commuter train every morning and night. Every day she rattles down the track, flashes past a stretch of cozy suburban homes, and stops at the signal that allows her to daily watch the same couple breakfasting on their deck. She’s even started to feel like she knows them. Jess and Jason, she calls them. Their life—as she sees it—is perfect. Not unlike the life she recently lost.UNTIL TODAYAnd then she sees something shocking. It’s only a minute until the train moves on, but it’s enough. Now everything’s changed. Unable to keep it to herself, Rachel goes to the police. But is she really as unreliable as they say? Soon she is deeply entangled not only in the investigation but in the lives of everyone involved. Has she done more harm than good?",Riverhead Books,2016-08-23,,,,,416.0,2025-06-19,1,Spring Hill Terrace,,6.0,,,,,
book,Negotiating The Future: A Labor Perspective On American Business,Barry Bluestone,Barry,Bluestone,9780465049172,0465049176,"It is no secret that corporate America is in trouble—as are labor unions—and a principal reason is our archaic system of labor-management relations, which excludes labor from participating in, and sharing responsibility for, the growth and profitability of the enterprises for which it works. In a book sure to arouse controversy in both management and labor circles, Barry and Irving Bluestone propose a new Enterprise Compact under which labor becomes co-responsible with management for all strategic business decisions—pricing, investment, plant location, and more.",Basic Books,1992-11-24,,,,,352.0,2025-06-19,1,Spring Hill Terrace,,13.0,Business & Economics,en,False,"Industrial relations -- United States, Management -- Employee participation -- United States",
book,Reel Bad Arabs: How Hollywood Vilifies a People,Jack G. Shaheen,Jack,Shaheen,9781566563888,1566563887,"Countless movies have portrayed Arabs as loathsome lechers who terrorise, murder, and finally die in drovesl In Reel Bad Arabs film scholar Jack Shaheen exposes in fascinating detail this appalling side of the Hollywood 'dream' machine. This stupendous study dissects this slanderous history dating from cinema's earliest days to contemporary Hollywood blockbusters that feature Bedouin bandits, sinister sheikhs, machine-gun wielding and bomb-blowing ""evil"" Arabs. He examines how and why such a stereotype has grown and spread in the film industry and what may be done to change Hollywood's defamation of Arabs.",Interlink Publishing Group,2001-07-31,,,,,592.0,2025-06-19,1,Spring Hill Terrace,,14.0,Performing Arts,en,False,Arabs in motion pictures,
book,That Kind of Mother,Rumaan Alam,Rumaan,Alam,9780062667618,0062667610,"NAMED A RECOMMENDED BOOK OF 2018 BY: Buzzfeed * The Boston Globe *  The Millions * InStyle * Southern Living * Vogue * Popsugar * Kirkus * The Washington Post * Library Journal * Real Simple * NPR ""With his unerring eye for nuance and unsparing sense of irony, Rumaan Alam's second novel is both heartfelt and thought-provoking.""    -- Celeste Ng, author of Little Fires Everywhere From the celebrated author of Rich and Pretty, a novel about the families we fight to build and those we fight to keep Like many first-time mothers, Rebecca Stone finds herself both deeply in love with her newborn son and deeply overwhelmed. Struggling to juggle the demands of motherhood with her own aspirations and feeling utterly alone in the process, she reaches out to the only person at the hospital who offers her any real help--Priscilla Johnson--and begs her to come home with them as her son's nanny. Priscilla's presence quickly does as much to shake up Rebecca's perception of the world as it does to stabilize her life. Rebecca is white, and Priscilla is black, and through their relationship, Rebecca finds herself confronting, for the first time, the blind spots of her own privilege. She feels profoundly connected to the woman who essentially taught her what it means to be a mother. When Priscilla dies unexpectedly in childbirth, Rebecca steps forward to adopt the baby. But she is unprepared for what it means to be a white mother with a black son. As she soon learns, navigating motherhood for her is a matter of learning how to raise two children whom she loves with equal ferocity, but whom the world is determined to treat differently. Written with the warmth and psychological acuity that defined his debut, Rumaan Alam has crafted a remarkable novel about the lives we choose, and the lives that are chosen for us.",HarperCollins Publishers,2019-02-19,,,,,304.0,2025-06-19,1,Spring Hill Terrace,paperback,3.0,Fiction,en,False,,
book,All You Can Ever Know,Nicole Chung,Nicole,Chung,9781948226370,1948226375,"Long-listed for PEN Open Book Award Named a Best Book of the Year byThe Washington Post, NPR,Time,The Boston Globe,Real Simple,Buzzfeed, Jezebel,Bustle,Library Journal, Chicago Public Library, and more ""This book moved me to my very core. . . . [All You Can Ever Know] should be required reading for anyone who has ever had, wanted, or found a familyâe*which is to say, everyone."" âe*Celeste Ng, author ofLittle Fires Everywhere What does it mean to lose your roots--within your culture, within your family--and what happens when you find them? Nicole Chung was born severely premature, placed for adoption by her Korean parents, and raised by a white family in a sheltered Oregon town. From childhood, she heard the story of her adoption as a comforting, prepackaged myth. She believed that her biological parents had made the ultimate sacrifice in the hope of giving her a better life, that forever feeling slightly out of place was her fate as a transracial adoptee. But as Nicole grew up--facing prejudice her adoptive family couldn't see, finding her identity as an Asian American and as a writer, becoming ever more curious about where she came from--she wondered if the story she'd been told was the whole truth. With warmth, candor, and startling insight, Nicole Chung tells of her search for the people who gave her up, which coincided with the birth of her own child.All You Can Ever Know is a profound, moving chronicle of surprising connections and the repercussions of unearthing painful family secrets--vital reading for anyone who has ever struggled to figure out where they belong.",Catapult,2019-10-15,,,,,256.0,2025-06-19,1,Spring Hill Terrace,,1.0,Biography & Autobiography,en,False,,
book,The Marrow of Tradition (Ann Arbor Paperbacks),Charles W. Chesnutt,Charles,Chesnutt,9780472061471,047206147X,"A stirring tale of racial confrontation in a reconstructionist Southern town, first published in 1901",Ann Arbor Paperbacks,1969-08-15,,,,,352.0,2025-06-19,1,Spring Hill Terrace,Paperback,10.0,Fiction,en,False,"Reference Information and Interdisciplinary Subjects, Literature: Classics, Ethnic Studies - African American Studies - General, Literature - Classics / Criticism, Wilmington (N.C.), Race relations, American - General, Classics, Social Science / African-American Studies, African Americans, Fiction, Racially mixed people",12.8 ounces
book,Leave the World Behind,Rumaan Alam,Rumaan,Alam,9780062667649,0062667645,"A Read with Jenna Today Show Book Club Pick! Finalist for the 2020 National Book Award (Fiction) A Best Book of the Year From: The Washington Post * Time * NPR * Elle * Esquire * Kirkus * Library Journal * The Chicago Public Library * The New York Public Library * BookPage * The Globe and Mail * EW.com * The LA Times * USA Today * InStyle * The New Yorker * AARP * Publisher's Lunch * LitHub * Book Marks * Electric Literature * Brooklyn Based * The Boston Globe A magnetic novel about two families, strangers to each other, who are forced together on a long weekend gone terribly wrong. From the bestselling author of Rich and Pretty comes a suspenseful and provocative novel keenly attuned to the complexities of parenthood, race, and class. Leave the World Behind explores how our closest bonds are reshaped--and unexpected new ones are forged--in moments of crisis. Amanda and Clay head out to a remote corner of Long Island expecting a vacation: a quiet reprieve from life in New York City, quality time with their teenage son and daughter, and a taste of the good life in the luxurious home they've rented for the week. But a late-night knock on the door breaks the spell. Ruth and G. H. are an older couple--it's their house, and they've arrived in a panic. They bring the news that a sudden blackout has swept the city. But in this rural area--with the TV and internet now down, and no cell phone service--it's hard to know what to believe. Should Amanda and Clay trust this couple--and vice versa? What happened back in New York? Is the vacation home, isolated from civilization, a truly safe place for their families? And are they safe from one other? ",HarperCollins Publishers,2021-11-23,,,,,272.0,2025-06-19,1,Spring Hill Terrace,paperback,3.0,Fiction,en,False,,
book,The Three Mothers,Anna Malaika Tubbs,Anna,Tubbs,9781250756121,125075612X,"Much has been written about Berdis Baldwin's son James, about Alberta King's son Martin Luther, and Louise Little's son Malcolm. But virtually nothing has been said about the extraordinary women who raised them. In her groundbreaking and essential debutThe Three Mothers, scholar Anna Malaika Tubbs celebrates Black motherhood by telling the story of the three women who raised and shaped some of America's most pivotal heroes. One ofFortune Magazine's 21 Books to Look Foward to in 2021 Badass Women's Bookclub pick for ""Badass Books We Can't Wait to Read in 2021!"" Berdis Baldwin, Alberta King, and Louise Little were all born at the beginning of the 20th century and forced to contend with the prejudices of Jim Crow as Black women. These three extraordinary women passed their knowledge to their children with the hope of helping them to survive in a society that would deny their humanity from the very beginning--from Louise teaching her children about their activist roots, to Berdis encouraging James to express himself through writing, to Alberta basingall of her lessons in faith and social justice. These women used their strength and motherhood to push their children toward greatness, all with a conviction that every human being deserves dignity and respect despite the rampant discrimination they faced. These three mothers taught resistance and a fundamental belief in the worth of Black people to their sons, even when these beliefs flew in the face of America's racist practices and led to ramifications for all three families' safety. The fight for equal justice and dignity came above all else for the three mothers. These women, their similarities and differences, as individuals and as mothers, represent a piece of history left untold and a celebration of Black motherhood long overdue.",Flatiron Books,2021-02-02,,,,,272.0,2025-06-19,1,Spring Hill Terrace,hardcover,6.0,Biography & Autobiography,en,False,,
book,Shade: A Tale of Two Presidents,Pete Souza,Pete,Souza,9780316421829,0316421820,"From Pete Souza, the #1 New York Times bestselling author of Obama: An Intimate Portrait, comes a powerful tribute to a bygone era of integrity in politics.As Chief Official White House Photographer, Pete Souza spent more time alongside President Barack Obama than almost anyone else. His years photographing the President gave him an intimate behind-the-scenes view of the unique gravity of the Office of the Presidency--and the tremendous responsibility that comes with it.Now, as a concerned citizen observing the Trump administration, he is standing up and speaking out.Shade is a portrait in Presidential contrasts, telling the tale of the Obama and Trump administrations through a series of visual juxtapositions. Here, more than one hundred of Souza's unforgettable images of President Obama deliver new power and meaning when framed by the tweets, news headlines, and quotes that defined the first 500 days of the Trump White House.What began with Souza's Instagram posts soon after President Trump's inauguration in January 2017 has become a potent commentary on the state of the Presidency, and our country. Some call this ""throwing shade."" Souza calls it telling the truth.In Shade, Souza's photographs are more than a rejoinder to the chaos, abuses of power, and destructive policies that now define our nation's highest office. They are a reminder of a President we could believe in, and a courageous defense of American values.","Little, Brown and Company",2018-10-16,,,,,240.0,2025-06-19,1,Spring Hill Terrace,,5.0,Photography,en,False,"Politics and government, Presidents, Pictorial works",
book,"Dude, Where's My Country?",Michael Moore,Michael,Moore,9780446532235,0446532231,"A #1 ""New York Times"" bestseller, Michael Moore tells what has gone wrong with America and maps out what regular citizens can do to reclaim their stolen country.",Warner,,,,,,,2025-06-19,1,Spring Hill Terrace,,8.0,Humor,en,False,,
book,The Last Time They Met: A Novel,Anita Shreve,Anita,Shreve,9780316781268,0316781266,"From the last time Linda and Thomas meet, at a charmless hotel in a distant city, to the moment, thirty-five years earlier, when a chance encounter on a rocky beach binds them fatefully together, this hypnotically compelling novel unfolds a tale of intense passion, drama, and suspense. The Last Time They Met is a singularly ambitious and accomplished work by one of today&#039;s most widely celebrated novelists.",Back Bay Books,2002-01-22,,,,,352.0,2025-06-19,1,Spring Hill Terrace,Paperback,8.0,Fiction,en,False,"Psychological, Fiction, Fiction - General, General, Literary, Fiction / Psychological, Romance - General",11.2 ounces
book,Jack Strong Takes a Stand (Charlie Joe Jackson),Tommy Greenwald,Tommy,Greenwald,9781250056870,125005687X,"Jack Strong just wants to be a regular kid. But his parents have overscheduled his week with every extracurricular activity under the sun: tennis, baseball, cello, karate, tutoring, and Chinese language lessons--all on top of regular homework. His parents want him to be ""well-rounded"" and prepared for those crucial college applications. Jack's just about had enough. And so, he stages a sit-in on his couch and refuses to get up until his parents let him quit some of the extracurriculars. As Jack's protest gains momentum, he attracts a local television host who is interested in doing a segment about him. Tensions rise as counter-protesters camp out across the street from Jack and his couch. Jack's enjoying this newfound attention, but he's worried that this sit-in may have gone too far.",Square Fish,2015-01-27,,,,,256.0,2025-06-20,1,Norfolk S,paperback,3.0,Juvenile Fiction,en,False,,
book,Master and Commander,Patrick O'Brian,Patrick,O'Brian,9780393307054,0393307050,"The beginning to the sweeping Aubrey/Maturin series. &quot;The best sea story I have ever read.&quot;&mdash;Sir Francis ChichesterThis, the first in the splendid series of Jack Aubrey novels, establishes the friendship between Captain Aubrey, R.N., and Stephen Maturin, ship&#039;s surgeon and intelligence agent, against a thrilling backdrop of the Napoleonic wars. Details of a life aboard a man-of-war are faultlessly rendered: the conversational idiom of the officers in the ward room and the men on the lower deck, the food, the floggings, the mysteries of the wind and the rigging, and the roar of broadsides as the great ships close in battle.",W. W. Norton & Company,1990-08-17,,,,,464.0,2025-06-20,1,Norfolk S,,13.0,Fiction,en,False,,
book,Station Eleven,Emily St. John Mandel,Emily,Mandel,9780804172448,0804172447,"A National Book Award FinalistA PEN/Faulkner Award Finalist Kirsten Raymonde will never forget the night Arthur Leander, the famous Hollywood actor, had a heart attack on stage during a production of King Lear. That was the night when a devastating flu pandemic arrived in the city, and within weeks, civilization as we know it came to an end. Twenty years later, Kirsten moves between the settlements of the altered world with a small troupe of actors and musicians. They call themselves The Traveling Symphony, and they have dedicated themselves to keeping the remnants of art and humanity alive. But when they arrive in St. Deborah by the Water, they encounter a violent prophet who will threaten the tiny band’s existence. And as the story takes off, moving back and forth in time, and vividly depicting life before and after the pandemic, the strange twist of fate that connects them all will be revealed.",Vintage,2015-06-02,,,,,352.0,2025-06-20,1,Norfolk S,,15.0,Fiction,en,False,,
